{
  "schema_identity": "infinium.repository.m1-slice6-c2-official-document-snapshot/2.0.0",
  "retrieved_window_utc": { "first": "2026-08-19T18:56:30.5740304Z", "last": "2026-08-19T18:56:31.3349670Z" },
  "sources": [
    { "name": "model", "url": "https://developers.openai.com/api/docs/models/gpt-5.6-sol.md", "retrieved_at_utc": "2026-08-19T18:56:30.5740304Z", "bytes": 3707, "sha256": "124cce0f52e97d87bca8d5c383dc9912bdfbcd8b5c3b54a7f209dc8383f9a4ad" },
    { "name": "latest-model", "url": "https://developers.openai.com/api/docs/guides/latest-model.md", "retrieved_at_utc": "2026-08-19T18:56:30.7740720Z", "bytes": 18668, "sha256": "7591e641abc3cb124b2173843a03d40ea05ee421c8a036f04dda44c79188953e" },
    { "name": "prompt-caching", "url": "https://developers.openai.com/api/docs/guides/prompt-caching.md", "retrieved_at_utc": "2026-08-19T18:56:30.8221582Z", "bytes": 27997, "sha256": "2402d5a0bc2643daa28100121fa0397f1893d3e30552e9d0317ebf18288e8348" },
    { "name": "reasoning", "url": "https://developers.openai.com/api/docs/guides/reasoning.md", "retrieved_at_utc": "2026-08-19T18:56:30.8943168Z", "bytes": 45218, "sha256": "237067018b227133a45f5465b545fd06596631c6a96bd6adec5835450354d7b1" },
    { "name": "structured-outputs", "url": "https://developers.openai.com/api/docs/guides/structured-outputs.md", "retrieved_at_utc": "2026-08-19T18:56:30.9588237Z", "bytes": 86127, "sha256": "e894b773b2aa124f07baf3d3e232abf4cd8bed2e3d80f789078f98fed06b55db" },
    { "name": "safety-best-practices", "url": "https://developers.openai.com/api/docs/guides/safety-best-practices.md", "retrieved_at_utc": "2026-08-19T18:56:31.1006631Z", "bytes": 7626, "sha256": "109a4729274e9a27435f8f1f0dc9f70fdd0f83eec7766c49ea661af94879f403" },
    { "name": "pricing", "url": "https://developers.openai.com/api/docs/pricing.md", "retrieved_at_utc": "2026-08-19T18:56:31.2770441Z", "bytes": 20660, "sha256": "9d64e55b063ded909cd6d1eab62e0c8bead1fdcdc1704d373e7e760bc2dd07f5" },
    { "name": "data-controls", "url": "https://developers.openai.com/api/docs/guides/your-data.md", "retrieved_at_utc": "2026-08-19T18:56:31.3349670Z", "bytes": 69040, "sha256": "26ea449d05a822506966635a7ba61df9b228c3adbe544eab22fa6465131cd42b" }
  ],
  "accepted_profile": { "model": "gpt-5.6-sol", "api": "responses", "reasoning_effort": "medium", "structured_outputs": true, "store": false, "service_tier": "default", "stream": false, "provider_tools": "none", "context_window_tokens": 1050000, "maximum_input_tokens": 922000, "maximum_output_tokens": 128000 },
  "pricing": { "currency": "USD", "nano_usd_per_token": { "ordinary_input": 5000, "cache_read": 500, "cache_write": 6250, "output": 30000 }, "long_context_threshold_tokens": 272000, "long_context_input_multiplier": 2, "long_context_output_multiplier": 1.5, "budget_class": "short-context-cache-write-worst-case-no-assumed-hit" },
  "data_and_cache": { "response_storage": "disabled-store-false", "background": false, "batch": false, "prompt_cache_mode": "explicit-with-no-breakpoints", "prompt_cache_key": null, "cache_budget_assumption": "no-hit-assumed-cover-cache-write-price", "retention_claim": "no-zero-data-retention-claim-owner-account-controls-remain-provider-account-facts" },
  "drift_policy": { "pre_effect_revalidation": "required-immediately-before-each-effect", "migration": "prohibited-without-owner-decision", "price_increase": "reduce-within-ceilings-or-stop-never-raise", "capability_conflict": "stop-affected-path-for-owner-decision", "source_domains": ["developers.openai.com", "platform.openai.com"] }
}
